<?xml version="1.0" encoding="UTF-8" ?><Results xmlns:xsi="http://www.w3.org/2001/XMLSchema-instance" xsi:noNamespaceSchemaLocation="PingResultsSchema.xsd">
<PingReplyRecord><TargetAddress>127.0.0.1</TargetAddress><Status>Success</Status><RoundtripTime>0</RoundtripTime></PingReplyRecord><PingReplyRecord><TargetAddress>192.168.0.1</TargetAddress><Status>Success</Status><RoundtripTime>4</RoundtripTime></PingReplyRecord><PingReplyRecord><TargetAddress>128.0.0.1</TargetAddress><Status>TimedOut</Status><RoundtripTime>0</RoundtripTime></PingReplyRecord><PingReplyRecord><TargetAddress>192.168.0.2</TargetAddress><Status>TimedOut</Status><RoundtripTime>0</RoundtripTime></PingReplyRecord><PingReplyRecord><TargetAddress>192.168.0.3</TargetAddress><Status>TimedOut</Status><RoundtripTime>0</RoundtripTime></PingReplyRecord></Results>